{
    "version": 1,
    "room_id": 1,
    "theme": "DESK_WOOD",
    "bg_image": null,
    "spawn": {
        "x": 43,
        "y": 19
    },
    "grid_w": 60,
    "grid_h": 20,
    "grid": [
        [
            {
                "type": 1
            },
            {
                "type": 1
            },
            {
                "type": 1
            },
            {
                "type": 1
            },
            {
                "type": 1
            },
            {
                "type": 1
            },
            {
                "type": 1
            },
            {
                "type": 1
            },
            {
                "type": 1
            },
            {
                "type": 1
            },
            {
                "type": 1
            },
            {
                "type": 1
            },
            {
                "type": 1
            },
            {
                "type": 1
            },
            {
                "type": 1
            },
            {
                "type": 1
            },
            {
                "type": 1
            },
            {
                "type": 1
            },
            {
                "type": 1
            },
            {
                "type": 1
            },
            {
                "type": 1
            },
            {
                "type": 1
            },
            {
                "type": 1
            },
            {
                "type": 1
            },
            {
                "type": 1
            },
            {
                "type": 1
            },
            {
                "type": 1
            },
            {
                "type": 1
            },
            {
                "type": 1
            },
            {
                "type": 1
            },
            {
                "type": 1
            },
            {
                "type": 1
            },
            {
                "type": 1
            },
            {
                "type": 1
            },
            {
                "type": 1
            },
            {
                "type": 1
            },
            {
                "type": 1
            },
            {
                "type": 1
            },
            {
                "type": 1
            },
            {
                "type": 1
            },
            {
                "type": 1
            },
            {
                "type": 1
            },
            {
                "type": 1
            },
            {
                "type": 1
            },
            {
                "type": 1
            },
            {
                "type": 1
            },
            {
                "type": 1
            },
            {
                "type": 1
            },
            {
                "type": 1
            },
            {
                "type": 1
            },
            {
                "type": 1
            },
            {
                "type": 1
            },
            {
                "type": 1
            },
            {
                "type": 1
            },
            {
                "type": 1
            },
            {
                "type": 1
            },
            {
                "type": 1
            },
            {
                "type": 1
            },
            {
                "type": 1
            },
            {
                "type": 1
            }
        ],
        [
            {
                "type": 1
            },
            {
                "type": 0
            },
            {
                "type": 0
            },
            {
                "type": 0
            },
            {
                "type": 0
            },
            {
                "type": 0
            },
            {
                "type": 0
            },
            {
                "type": 0
            },
            {
                "type": 0
            },
            {
                "type": 0
            },
            {
                "type": 0
            },
            {
                "type": 0
            },
            {
                "type": 0
            },
            {
                "type": 0
            },
            {
                "type": 0
            },
            {
                "type": 0
            },
            {
                "type": 1
            },
            {
                "type": 0
            },
            {
                "type": 0
            },
            {
                "type": 0
            },
            {
                "type": 0
            },
            {
                "type": 0
            },
            {
                "type": 0
            },
            {
                "type": 0
            },
            {
                "type": 0
            },
            {
                "type": 0
            },
            {
                "type": 0
            },
            {
                "type": 0
            },
            {
                "type": 0
            },
            {
                "type": 0
            },
            {
                "type": 0
            },
            {
                "type": 0
            },
            {
                "type": 0
            },
            {
                "type": 0
            },
            {
                "type": 0
            },
            {
                "type": 1
            },
            {
                "type": 0
            },
            {
                "type": 0
            },
            {
                "type": 0
            },
            {
                "type": 0
            },
            {
                "type": 0
            },
            {
                "type": 0
            },
            {
                "type": 0
            },
            {
                "type": 0
            },
            {
                "type": 0
            },
            {
                "type": 0
            },
            {
                "type": 1
            },
            {
                "type": 0
            },
            {
                "type": 0
            },
            {
                "type": 0
            },
            {
                "type": 0
            },
            {
                "type": 0
            },
            {
                "type": 0
            },
            {
                "type": 0
            },
            {
                "type": 0
            },
            {
                "type": 0
            },
            {
                "type": 0
            },
            {
                "type": 0
            },
            {
                "type": 0
            },
            {
                "type": 1
            }
        ],
        [
            {
                "type": 1
            },
            {
                "type": 0
            },
            {
                "type": 0
            },
            {
                "type": 0
            },
            {
                "type": 0
            },
            {
                "type": 0
            },
            {
                "type": 0
            },
            {
                "type": 0
            },
            {
                "type": 0
            },
            {
                "type": 0
            },
            {
                "type": 0
            },
            {
                "type": 0
            },
            {
                "type": 0
            },
            {
                "type": 0
            },
            {
                "type": 0
            },
            {
                "type": 0
            },
            {
                "type": 1
            },
            {
                "type": 0
            },
            {
                "type": 0
            },
            {
                "type": 0
            },
            {
                "type": 0
            },
            {
                "type": 0
            },
            {
                "type": 1
            },
            {
                "type": 0
            },
            {
                "type": 0
            },
            {
                "type": 0
            },
            {
                "type": 0
            },
            {
                "type": 0
            },
            {
                "type": 0
            },
            {
                "type": 0
            },
            {
                "type": 0
            },
            {
                "type": 0
            },
            {
                "type": 0
            },
            {
                "type": 0
            },
            {
                "type": 0
            },
            {
                "type": 1
            },
            {
                "type": 0
            },
            {
                "type": 0
            },
            {
                "type": 0
            },
            {
                "type": 0
            },
            {
                "type": 0
            },
            {
                "type": 0
            },
            {
                "type": 0
            },
            {
                "type": 0
            },
            {
                "type": 0
            },
            {
                "type": 0
            },
            {
                "type": 1
            },
            {
                "type": 0
            },
            {
                "type": 0
            },
            {
                "type": 0
            },
            {
                "type": 0
            },
            {
                "type": 0
            },
            {
                "type": 0
            },
            {
                "type": 0
            },
            {
                "type": 0
            },
            {
                "type": 0
            },
            {
                "type": 0
            },
            {